Species,Species ID,Anticodon before mutation,Anticodon after mutation,Stop codon for readthrough,Noncanonical charged amino acids,RNA central ID of tRNA,tRNAscan SE ID of tRNA,tRNA sequence before mutation,tRNA sequence after mutation,Structure of sup-tRNA,Readthrough mechanism,Mutational position of sup-tRNA,PMID of references,Note
Amoebophyra sp. ex Karlodinium veneficum,,not given,CUA,UAG(amber),Gln,,,not given,GGGCCUAUGGUGUAACGGUUAGCGCUCCGGAUUCUAAGUCCGGCAAUGGGGGUUCAAAUCCCUCUGGGCUCU, ,recode/reassignment ,,30818350,"When UAA and UAG are translated as glutamine about half of the alignments have better BLASTx scores,"
Amoebophyra sp. ex Karlodinium veneficum,,not given,CUA,UAG(amber),Gln,,,not given,GGGGGUAUGGUGUAGUGGUUAGCGCUCCAGAUUCUAGGUCUGGCAACGGGGGUUCGAAUCCCUCUGCCCCUU, ,recode/reassignment ,,30818350,"When UAA and UAG are translated as glutamine about half of the alignments have better BLASTx scores,"
Amoebophyra sp. ex Karlodinium veneficum,,not given,UUA,UAA(ochre),Gln,,,not given,GGGCGUAUGGUGUAGUGGUUAGCGCUCCAGAUUUUAGGUCUGGCAACGGGGGUUCGAAUCCCUCUGCGCCUU, ,recode/reassignment ,,30818350,"When UAA and UAG are translated as glutamine about half of the alignments have better BLASTx scores,"
Amoebophyra sp. ex Karlodinium veneficum,,not given,UCA,UGA(opal),Trp,,,not given,GACACAGUGGCAGAGAGGUUAAUGCUUCAGUCUUCAAAUCUGAAAUUUUUGGGUUUGAGUCUGAUUAGUGGCA, ,recode/reassignment ,,30818350,When UGA istranslated as tryptophan one fifth of the alignments have better scores.
Bacteriophage T4,,UCU,UCA,UGA(opal),Arg,,,GUCCCGCUGGUGUAAU#GADAGCAUACGAUCCUNCUAAGPUUGCGGUCCUGGTPCGAUCCCAGGGCGGGAUACCA,GUCCCGCUGGUGUAAU#GADAGCAUACGAUCCUNC\AAAGPUUGCGGUCCUGGTPCGAUCCCAGGGCGGGAUACCA, ,a single base mutation in anticodon,UCU is mutated to UCA in the anticodon. This mutation is believed to confer UGA suppressor activity on the arginine tRNA. ,914869,The modification of U at position 34 is not described in the article.
Bacteriophage T4,,NGA,CUA,UAG(amber),Ser,,,GGAGGCG4GGCAGAGU#GDDUAAUGCACCGGUBUNGA*AACCGGCAGUCGCUCCGGCGACUCAUAGGTPCAAAUCCUAUCGCCUCCGCCA,GGAGGCG4GGCAGAGU#GDDUAAUGCACCGGUBU\C\UA*AACCGGCAGUCGCUCCGGCGACUCAUAGGTPCAAAUCCUAUCGCCUCCGCCA, ,other,"The wild-type and psu1+ tRNAs have the same sequence except for their anticodons, where NGA in the wild-type species is mutated to CUA in the psu1+ species.These mutations confer suppressor activity on the tRNA by enabling it to recognize the UAG nonsense codon.",1214302,"Serine tRNA is not synthesized by mutants in psu1+ A67, U70 and U75. Secondary mutants of psu selected for loss of suppressor activity are blocked in the production of serine tRNA"
Bacteriophage T4,,NUG,NUA,"UAA(ochre),UAG(amber)",Gln,,,UGGGAAU4AGCCAAGDDGGDAAGGCAUAGCACUNUGɿCPGCUAGAUGCAAAGGTPCGAGUCCUUUAUUCCCAGCCA,UGGGAAU4AGCCAAGDDGGDAAGGCAUAGCACUNU\AɿCPGCUAGAUGCAAAGGTPCGAGUCCUUUAUUCCCAGCCA, ,a single base mutation in anticodon,"The wild-type and psu2+ tRNAs have the same sequence except for their anticodons, where NUG in the wild-type species is mutated to NUA in the psu2+ species. The anticodon change confers suppressor activity on the glutamine tRNA by enabling it to recognize amber (UAG) and ochre (UAA) codons.",4375202,"1.The modified nucleotide N recognizes both G and A in the third position of the codon.
2.How the mutations of psu2+ in U11,A40 and U62 result in the loss of suppressor activity is unknown."
Bacteriophage T4,,NUA,CUA,UAG(amber),Gln,,,UGGGAAU4AGCCAAGDDGGDAAGGCAUAGCACUNUAɿCPGCUAGAUGCAAAGGTPCGAGUCCUUUAUUCCCAGCCA,UGGGAAU4AGCCAAGDDGGDAAGGCAUAGCACU\CUAɿCPGCUAGAUGCAAAGGTPCGAGUCCUUUAUUCCCAGCCA, ,a single base mutation in anticodon,"The wild-type glutamlne tRNA has the antlcodon NUG, and the psu2+ single-mutant tRNA has the anticodon NUA, a psu2+ C34 double mutant has CUA,which can suppress UAG. ",1206705,
Bovine,,not given,CmCA,UGA(opal),Ser,,,not given,GCCCGLAUGAUCCUCAGUGGUCCGGGGUGDAGGCUBCAЧACCUGUAGCUGUCUAGCGACAGAGUGGUPCAѢUUCCACCUUUCGGGCGCCA, ,other,"The Ser tRNA is aminoacylated with serine and not with tryptophan perhaps because of the anomalous structure of the dihydrouridine stem of bovine liver Ser tRNA. Compared to other tRNAs, this tRNA has two extra nucleotides between the universal residue U at position 8 and A at position 14 and the presence of an extra unpaired nucleotide within the doublestranded loop IV stem.",6912798,This tRNA is purified from bovine liver and shows extremely low homology to other mammalian serine (47-52% homology) or tryptophan (49% homology) tRNAs.
chicken,,not given,UCA,UGA(opal),Ser,,,not given,GCCCGGAUGACCCUCAGUGGUCUGGGGUGCAGGCUUCAAACCUGUAGCUGUCUAGCGACAGAGUGGUUCAAUUCCACCUUUCGGGCG, ,unknown,not given,6308662,The opal suppressor serine tRNA is purified from chicken liver.
ciliate(Tetrahymena thermophila),,not given,UmUA,"UAA(ochre),UAG(amber)",Gln,,,not given,GGUUCCAUALUAPAGDGGDDAGUACUGGGGABUJUAЧAPCCCUUGAC?UGGGUPCGѢAUCCCAGUGGGACCUCCA, ,unknown,Perhaps one of the suppressor tRNAs (probably tRNA UmUA) has evolved from normal glutamine tRNA (tRNA UmUG) and then tRNA CUA derived from tRNA UmUA to strengthen recognition of the UAG codon.It is more likely that the ciliates lost UAA and UAG as termination codons in their evolution.,16453685,Tetrahymena uses UAA and UAG as glutamine codons and that UGA may be the only functional termination codon.
ciliate(Tetrahymena thermophila),,not given,CUA,UAG(amber),Gln,,,not given,GGUUCUAUALUAPAGCGCDDAGUACUGGGGAѴUCUAЧAPCCCUUGAC?UGGGUPCGѢAUCCCAGUAGGACCUCCA, ,unknown,Perhaps one of the suppressor tRNAs (probably tRNA UmUA) has evolved from normal glutamine tRNA (tRNA UmUG) and then tRNA CUA derived from tRNA UmUA to strengthen recognition of the UAG codon.It is more likely that the ciliates lost UAA and UAG as termination codons in their evolution.,16453685,"1.The tRNA has unusually strong readthrough efficiency, e.g. purified Gln tRNA CUA achieves complete readthrough over the UAG stop codon of TMV RNA.
2.The base in position 32（N） is probably a derivative of C."
heterotrichous ciliate(Condylostoma magnum、Parduzcia sp.) ,,not given,CUA,UAG(amber),Gln,,,not given,AGGCCCUAUAGUGUAAUGGCCAACACAUUGGACUCUAACUCCACUGCUCUGAGUUCGAAUCUCAGTGGGGCCUUC, ,recode/reassignment ,"Ciliates can reassign standard stop codons to amino acids, resulting in variant genetic codes.",27426948,"The UGA codon is reassigned to Trp. However, the UGA usage in C. magnum and Parduczia sp. is relatively low (0.042% and 0.120%, respectively).The structure of Trp-RNA is not shown in the article."
heterotrichous ciliate(Condylostoma magnum、Parduzcia sp.) ,,not given,UUA,UAA(ochre),Gln,,,not given,AGCUCUGUAGUGUAAUGGUGAACACUUUGGACUUUAAAUCCAACACUCCGAGUUCGAAUCUCGGCAGAGCUUC, ,recode/reassignment ,"Ciliates can reassign standard stop codons to amino acids, resulting in variant genetic codes.",27426948,"The UGA codon is reassigned to Trp. However, the UGA usage in C. magnum and Parduczia sp. is relatively low (0.042% and 0.120%, respectively).The structure of Trp-RNA is not shown in the article."
Escherichia coli,,CCA,CCA,UGA(opal),Trp,,,AGGGGCG4AGUUCAADDGGDAGAGCACCGGUBUCCA*AACCGGGU7UUGGGAGTPCGAGUCUCUCCGCCCCUGCCA,AGGGGCG4AGUUCAADDGGDAGA\ACACCGGUBUCCA*AACCGGGU7UUGGGAGTPCGAGUCUCUCCGCCCCUGCCA, ,a base mutation outside the anticodon,"A base mutation at position 24 from G to A in the stem of the dihydrouracil loop.Presumably, the mutation at position 24 reduces the rate at which the ribosome rejects non-cognate tRNAs, more easily permitting unconventional base pairing.The mutation reduces the rate at which the ribosome rejects non-cognate tRNAs, thus permitting the unconventional A:C pair in the codon-anticodon interaction.",4933412,"This article considers that U at position 8 is 4-thiouridine, but in the structure provided by another article(PMID:11726686), U is not modified."
Escherichia coli,,GUA,CUA,UAG(amber),Tyr,,,GGUGGGG4UCCCGAGC#GCCAAAGGGAGCAGACUʆUAHAPCUGCCGUCAUCGACUUCGAAGGTPCGAAUCCUUCCCCCACCACCA,GGUGGGG4UCCCGAGC#GCCAAAGGGAGCAGACU\CUAHAPCUGCCGUCAUCGACUUCGAAGGTPCGAAUCCUUCCCCCACCACCA, ,a single base mutation in anticodon,The amber suppressor gene is the structural gene for one of the tyrosine tRNAs of E. coli. The mutation in the anticodon results in a base change from GUA to CUA.This change enables the tRNA to recognize the amber codon UAG instead of the tyrosine codons UAU and UAC.,5643523,"1.U at position 8 is a sulphur-containing nucleotide, tentatively identified as 4-thiouridylic acid.
2.The modification of G at position 35 and its biological significance remain unknown.
3.A at position 38 presumably contains both sulphur and a methyl group. "
Escherichia coli,,CGA,CUA,UAG(amber),Ser,,,GGAGAGAUGCCGGAGC#GCDGAACGGACCGGUCUCGA*AACCGGAGUAGGGGCAACUCUACCGGGGGTPCAAAUCCCCCUCUCUCCGCCA,GGAGAGAUGCCGGAGC#GCDGAACGGACCGGUCUC\UA*AACCGGAGUAGGGGCAACUCUACCGGGGGTPCAAAUCCCCCUCUCUCCGCCA, ,a single base mutation in anticodon,supD:A single nudeotide mutation in the middle of the anticodon from G to A allows the suppressor tRNA to read the UAG stop codon.,6344015,
Escherichia coli,,CCA,CUA,UAG(amber),Gln,,,AGGGGCG4AGUUCAADDGGDAGAGCACCGGUBUCCA*AACCGGGU7UUGGGAGTPCGAGUCUCUCCGCCCCUGCCA,AGGGGCG4AGUUCAADDGGDAGAGCACCGGUBUC\UA*AACCGGGU7UUGGGAGTPCGAGUCUCUCCGCCCCUGCCA, ,a single base mutation in anticodon,"The suppressor tRNA is derived from Trp tRNA, which inserts glutamine in response to UAG, has a C for U substitution in the middle base of the anticodon. The mutational change alters both the coding specificity and amino acid-acceptor specificity(a loss of tryptophan-accepting specificity and the acquisition of glutamine-acceptor activity). ",4606150,"The su+7(UAG) tRNA is derived from Trp tRNA, which normally translates UGG as tryptophan.Since the tRNA needed to translate UGG as tryptophan is unique and is lost by the su+7(UAG) mutation, it is not surprising that the mutation is lethal in the haploid state (su+7) but is innocuous in heterozygous cells."
Escherichia coli,,CCA,UUA,"UAG(amber),UAA(ochre)",Gln,,,AGGGGCG4AGUUCAADDGGDAGAGCACCGGUBUCCA*AACCGGGU7UUGGGAGTPCGAGUCUCUCCGCCCCUGCCA,AGGGGCG4AGUUCAADDGGDAGAGCACCGGUBU\U\UA*AACCGGGU7UUGGGAGTPCGAGUCUCUCCGCCCCUGCCA, ,other,In the su+7(UAA/G) suppressor tRNA both C residues of the anticodon are replaced by U.,4606150,
Saccharomyces cereuisiae ,,not given,UCA,UGA(opal),Trp,,,not given,AAGGAUAUAGUUUAAUGGUAAAACAGUUGAUUUCAAAUCAAUCAUUAGGAGUUCGAAUCUCUUUAUCCUUGCCA, ,wobble/misread/mispair/mismatch,"The mitochondrial Trp tRNA  anticodon is UCA. Because there is a U in the wobble position, this tRNA can recognize and insert tryptophan into a growing polypeptide chain in response to the nonsense codon UGA.",6995848,The suppressor tRNA is isolated from mitochondria.
Saccharomyces cerevisiae,,GΨA,CΨA,UAG(amber),Tyr,,,CUCUCGGUALCCAAGDD#GDDDAAGGCRCAAGACUGPAЧAPCUUGAGAD?GGGCGTPCGѢCUCGCCCCCGGGAGACCA,CUCUCGGUALCCAAGDD#GDDDAAGGCRCAAGACU\CPAЧAPCUUGAGAD?GGGCGTPCGѢCUCGCCCCCGGGAGACCA, ,a single base mutation in anticodon,sup5:A mutant of tyrosine tRNA which has the anticodon CΨA instead of the normal GΨA.,785283、11726686,
Saccharomyces cerevisiae,,CGA,CUA,UAG(amber),Ser,,,GGCUACAUGGCMGAGD#GDDAAGGCRAGAGANUCGAЧAPCUCUJGGGCUCUGCCCG?GCUGGTPCAAAUCCUGCUGUGGUCGCCA,GGCUACAUGGCMGAGD#GDDAAGGCRAGAGANUC\UAЧAPCUCU\UGGGCUCUGCCCG?GCUGGTPCAAAUCCUGCUGUGGUCGCCA, ,a single base mutation in anticodon,SUP-RL1:The suppressor serine tRNA can read the codon UAG through a G to U anticodon base change ,355641,"1.N does not appear to correspond to any previousI reported uridine derivative.
2.Yeast serine tRNA is heterogeneous in nucleotide sequence and exists as at least two structures. Sequence analysis indicated that approximately half of the minor species from the SUP-RL1 suppressor-bearing strain MBD16 had the substitution of U for the G at position 35 and U for Um at position 44."
Saccharomyces cerevisiae,,CUG,CUG,UAG(amber),Gln,,,GGUCCUAAGUGUAGUGGUUAUCACUUUCGGUUCUGAUCCGAACCCAGUUCGAAUCCGGGUGGGACC,GGUCCUAAGUGUAGUGGUUAUCACUUUCGGUUCUGAUCCGAACCCAGUUCGAAUCCGGGUGGGACC, ,wobble/misread/mispair/mismatch,The tRNA Gln has the anticodon CUG allowing glutamine insertion and an inefficient translational readthrough of UAG by wobble in the first position of the codon.  ,3552889,
Schizosaccharomyces pombe,,not given,UCA,UGA(opal),Leu,,,not given,GCGGCUAUGCCMGAGDGGDGDAAGGGRGCAGAPUNCAKCCCUGCUGUUGUAAAACG?GAGAGTPCGѢACCUCUCUGGCCGCACCA, ,a single base mutation in anticodon,sup8:A nucleotide change in the anticodon which allows for complementary base pair recognition of the UGA codon,289895,"The hypermodified base, U, at the first position of the anticodon may be a derivative of 2-thiouridine."
Schizosaccharomyces pombe,,not given,UCA,UGA(opal),Ser,,,not given,GUCACUAUGUCMGAGDGGDDAAGGARPUAGAЩUUCAЧAPCUAAUGGGCUUUGCCCG?GCAGGTPCAѢAUCCUGCUGGUGACGCCA, ,a single base mutation in anticodon,sup3:A base substitution in the second anticodon position,461200,U at position 34 is a mixture of 2S mcm5U.
Nicotiana rustica chloroplast,,not given,GCA,UGA(opal),Cys,,,not given,GGCGACAUGGCCGAGU#GDAAGGCAGAGGACUGCAЧAPCCUUUUUUCCCCAGTPCAAAUCCGGGUGUCGCCUCCA, ,wobble/misread/mispair/mismatch,"The interaction of Cys tRNA with UGA requires an unconventional G:A base pair in the wobble position, as postulated earlier for plant Tyr tRNA misreading the UAA stop codon.",8524647,"1.This Cys tRNA is isolated from Nicotiana rustics chloroplast (chl).
2.The chl tRNA is more efficient than the cytoplasmic counterpart, which may be related to the modified base."
Nicotiana rustica cytoplasm,,not given,GCA,UGA(opal),Cys,,,not given,GGGUCCAUAGCUCAGD#GDAGAGCAPPUGABUGCAKAPCAAGAG7DCACCGGUPCGѢACCCGGUUGGGCCCUCCA, ,wobble/misread/mispair/mismatch,"The interaction of Cys tRNA with UGA requires an unconventional G:A base pair in the wobble position, as postulated earlier for plant Tyr tRNA misreading the UAA stop codon.",8524647,"1.This Cys tRNA is isolated from Nicotiana rustics cytoplasm (cyt).
2.Natural suppressor tRNAs require a special codon context for their readthrough."
Nicotiana rustica,,not given,CUG,UAG(amber),Gln,,,not given,GGUUCCAUKGUCPAGD#GDCAGGACAPUGGABUCUGAAPCCAGUAACCCGAGTPCAѢAUCUCGGUGGAACCUCCA, ,wobble/misread/mispair/mismatch,"An unorthodox base interaction, i.e. a G:U base pair at the third anticodon position.",9862487,This Gln tRNA is isolated from the cytoplasm of Nicotiana rustica.
Nicotiana rustica ,,not given,UmUG,UAG(amber),Gln,,,not given,GGUUCUAUKGUGPAGD#GDDAGCACUCPGGABUJUGɿAPCCAGCGACCUGGGTPCGѢCUCCCGGUAGGACCUCCA, ,wobble/misread/mispair/mismatch,Unconventional base pairing in anticodon-codon interactions.,9862487,
Nicotiana tobacco chloroplast,,CmCA,CmCA,UGA(opal),Trp,,,GCGCUCUUAGUUCAGUUC#GDAGAACGPGGGPCUBCAAAACCCGAUGNCGUAGGTPCAAAUCCUACAGAGCGUGCCA,GCGCUCUUAGUUCAGUUC#GDAGAACGPGGGPCUBCAAAACCCGAUGNCGUAGGTPCAAAUCCUACAGAGCGUGCCA, ,wobble/misread/mispair/mismatch,Chloroplast(chl) Trp tRNA with a CmCA anticodon efficiently suppresses the UGA misread stop codons by means of unconventional base interactions. Chloroplast Trp tRNA contains an A24:U11 pair in the D-stem as does the mutated Escherichia coli UGA-suppressor Trp tRNA.,1396598,"1.This suppressor tRNA is chloroplast (chl) tRNA with a sequence identical to the corresponding chl tRNA gene from Nicotiana tabacum.
2.Chl Trp tRNA suppresses the UGA stop codon more efficiently than cyt tRNA.
3.The suppressor activity of chl Trp tRNA is dependent on the nucleotides surrounding the stop codon because it recognizes UGA in the TRV context but not the UGA in the β-globin context.
4.A at position 38 is i6A or ms2i6A.In this article, the position of A is described as 37, but in fact, according to the sequence, the position is 38. In another article(PMID:11726686), A is described as i6A.
5.N at position 48 is probably an unidentified modified uridine. In this article, the position of N is described as 47, but in fact, according to the sequence, the position is 48."
Nicotiana tobacco cytoplasm,,CmCA,CmCA,UGA(opal),Trp,,,GGAUCCGUKGCGCAAD#GDAGCGCGPCUGABUBCAKAZCAGAAGGDNGCGUGTPCGѢUUCACGPCGGGUUCACCA,GGAUCCGUKGCGCAAD#GDAGCGCGPCUGABUBCAKAZCAGAAGGDNGCGUGTPCGѢUUCACGPCGGGUUCACCA, ,wobble/misread/mispair/mismatch,,1396598,"1.This suppressor tRNA is cytoplasmic (cyt) tRNA from Nicotiana tabacum.
2.Cytoplasmic(cyt) Trp tRNA is a weak UGA suppressor.
3.N at position 47 is probably an unidentified modified uridine. In this article, the position of N is described as 48, but in fact, according to the sequence, the position is 47.
4.The base at position 70 in this article is U, while in another article(PMID:11726686) it is C."
Nicotiana tabacum,,GΨA,GΨA,UAG(amber),Tyr,,,CCGACCUUAGCUCAGDD#GUAGAGCRGAGGACUGPAKAPCCUUAG7XCACUGGUPCGѢAUCCGGUAGGUCGGACCA,CCGACCUUAGCUCAGDD#GUAGAGCRGAGGACUGPAKAPCCUUAG7XCACUGGUPCGѢAUCCGGUAGGUCGGACCA, ,unknown,The nature of the recognition between UAG termination codon and GΨA anticodon of wild-type Tyr tRNA remains obscure.,16453503,"1.This natural suppressor tRNA is purified from uninfected tobacco plants, which has an A:U pair at the base of the TΨC stem.
2.Ribothymidine which was not detectable in the TΨC loop of the tRNA is replaced by unmodified U.
3.The modified nucleoside U in position 47 is most likely 3-(3-amino-3-carboxypropyl)uridine (apc3U)."
Nicotiana tabacum,,GΨA,GΨA,UAG(amber),Tyr,,,CCGACCUUALCUCAGDD#GUAGAGCRGAGGACUGPAKAPCCUUAG7XCGCUGGUPCGѢAUCCGGCAGGUCGGACCA,CCGACCUUALCUCAGDD#GUAGAGCRGAGGACUGPAKAPCCUUAG7XCGCUGGUPCGѢAUCCGGCAGGUCGGACCA, ,unknown,,16453503,"This natural suppressor tRNA is purified from uninfected tobacco plants, which contains a G:C pair at the base of the TΨC stem and m2G in position 10."
trypanosomatid(Blastocrithidia nonstop),,CCA,CCA,UGA(opal),Trp, ,,GGGGGCUUAGCUCAGUGGCAGAGUACUGGAUUCCAAAUCCAUGGGUCGCAGGUUCAAUUCCUGUAGUCCUCACCA,GGGGGCUUAGCUCAGUGGCAGAGUA\\\CUGGAUUCCAAAUCCA\\\UGGGUCGCAGGUUCAAUUCCUGUAGUCCUCACCA, ,recode/reassignment ,"The Trp tRNA anticodon stem is shortened from five to four base pairs,as an adaptation of the trypanosomatid to the in-frame stop codons.
The canonical 5-bp Trp tRNA recognizes UGG as dictated by the genetic code, whereas its shortened 4-bp variant incorporates tryptophan also into in-frame UGA.",36631608,
wheat germ,,GΨA,GΨA,UAG(amber),Tyr,,,CCGACCUUALCUCAGDD#GUAGAGCRGAGGACUGPAKAPCCUUAG7XCACUGGUPCGѢAUCCGGUAGGUCGGACCA,CCGACCUUALCUCAGDD#GUAGAGCRGAGGACUGPAKAPCCUUAG7XCACUGGUPCGѢAUCCGGUAGGUCGGACCA, ,unknown,"At present we can only accept as a fact, but not explain, that the GΨA anticodon interacts with the UAG termination codon and with the codons for tyrosine.The Ψ in the second position of the anticodon may interact with A more firmly than generally expected.The G of the GΨA anticodon plays a selective role in the recognition process, possibly being able to interact in the syn conformation with the G of UAG and not with the A of UAA.",16453524,"1.The uninfected tobacco plant contains two Tyr tRNAs, both with GΨA anticodons which stimulate the UAG readthrough.
In contrast,~85% of the Tyr tRNA from wheat germ contains a QΨA anticodon and ~15% has a GΨA anticodon. 
Otherwise the sequences of Tyr tRNAs from wheat germ and tobacco are identical. 
UAG readthrough is only stimulated by tRNA with GΨA anticodon, indicating that queuosine prevents the recognition between the anticodon and the UAG termination codon.
2.Compared with wheat leaves, the adult wheat contains tRNA with GΨA anticodon only.
3.The two Tyr tRNAs from wheat germ contained mainly an A:U pair (> 80%) at the base of the TΨC-stem and, to a low extent, a G:C pair.
4.Ribothymidine in the TΨC-loop of the tRNA is replaced by unmodified U. The modified U in position 47 is most likely 3-(3-amino-3-carboxypropyl)uridine (apc3U)"
