trypanosomatid(Blastocrithidia nonstop),,CCA,CCA,UGA(opal),Trp," ",,GGGGGCUUAGCUCAGUGGCAGAGUACUGGAUUCCAAAUCCAUGGGUCGCAGGUUCAAUUCCUGUAGUCCUCACCA,GGGGGCUUAGCUCAGUGGCAGAGUA\\\CUGGAUUCCAAAUCCA\\\UGGGUCGCAGGUUCAAUUCCUGUAGUCCUCACCA," ","recode/reassignment ","The Trp tRNA anticodon stem is shortened from five to four base pairs,as an adaptation of the trypanosomatid to the in-frame stop codons.
The canonical 5-bp Trp tRNA recognizes UGG as dictated by the genetic code, whereas its shortened 4-bp variant incorporates tryptophan also into in-frame UGA.",36631608,,36631608
Euplotes octocarinatus,,GCA,GCA,UGA(opal),Cys,,,GGGUCAAUAGCUCAGUGGUAGAGCAGCAGAUUGCAGAUCUGUAGGUCACCGGUUCGAUCCCGGUUUGGCCCU,GGGUCAAUAGCUCAGUGGUAGAGCAGCAGAUUGCAGAUCUGUAGGUCACCGGUUCGAUCCCGGUUUGGCCCU," ","recode/reassignment ,wobble/misread/mispair/mismatch","Deviations from the universal genetic code have evolved independently several times in ciliated protozoa. Thus, in some species UAA and UAG are no longer used as termination codons, but are read as glutamine, whereas in the genus Euplotes, UGA is translated as cysteine.Translation of the UGA codon by Cys tRNA with GCA anticodon necessitates a G:A mispairing in the first anticodon position.",9753721,,9753721
wheat germ,,UCG,UCG,UGA(opal),Arg,,,GACCGCAUAGCGCAGDGGAUXAGCGCRPCUGACUUCGKAPCAGAAG7D?GUGGGTPCGѢCUCCCACUGPGGUCGCCA,GACCGCAUAGCGCAGDGGAUXAGCGCRPCUGACUUCGKAPCAGAAG7D?GUGGGTPCGѢCUCCCACUGPGGUCGCCA," ",wobble/misread/mispair/mismatch,"Interaction of tRNA UCG with the UGA codon requires a G:U base pair at the third anticodon position. ",9490782,"Four cytoplasmic (cyt) Arg tRNA isoacceptors with ICG, CCG, UCG and CCU anticodons are purified from wheat germ.
The tRNA with UCG anticodon is an efficient UGA suppressor in vitro, whereas the other three Arg tRNA isoacceptors exhibit no or very low suppressor activity in wheat germ extract.
The hypermodified nucleoside at the first anticodon position of Arg tRNA is very likely mcm5U and/or mcm5s2U.",9490782
human,,UCA,UCA,UGA(opal),Ser,,,GCCCGGAUGAUCCUCAGUGGUCUGGGGUGCAGGCUUCAAACCUGUAGCUGUCUAGCGACAGAGUGGUUCAAUUCCACCUUUCGGGCG,GCCCGGAUGAUCCUCAGUGGUCUGGGGUGCAGGCUUCAAACCUGUAGCUGUCUAGCGACAGAGUGGUUCAAUUCCACCUUUCGGGCG," ",unknown,,3156131,"The human opal suppressor tRNA gene is isolated from the human DNA library, which is cloned in bacteriophage λ and screened with an opal suppressor tRNA probe.",3156131-1
human,,UCA,UCA,UGA(opal),Ser,,,GCUCGGAUGAUCCUCAGUGGUCUGGGGUGCAGGCUUCAAACCUGUAGCUGUCUAGUGACAGAGUGGUUCAAUUCCACCUUUGUAGGC,GCUCGGAUGAUCCUCAGUGGUCUGGGGUGCAGGCUUCAAACCUGUAGCUGUCUAGUGACAGAGUGGUUCAAUUCCACCUUUGUAGGC," ",unknown,,3156131,"Another second human gene(HG-2) appears to be a pseudogene truncated near the 3’ end. It has a C at position 87 instead of a G which is present in the other two tRNA genes. Bases at position 86 (G), 83 (U), and 82 (G) do not complement bases at positions 1 (G), 4 (C), and 5 (G) in the cloverleaf form of the mature tRNA. The two human genes show greater than 90% homology in theirsequences, differing only in positions 3, 56, 82, 83, 84, 86, and 87.",3156131-2
